{
  "$schema": "https://json-schema.org/draft/2020-12/schema",
  "$id": "https://boi.app/schema/chat_reply.v2.json",
  "title": "Chat reply v2",
  "description": "Extends chat_reply.v1 with kind = 'open': fluid, model-generated prose from the v3 agent path (V3_ARCHITECTURE.md §2), verified post-generation (I1/I2) rather than assembled from a closed license template. 'answer'/'decline' keep v1's exact shape and semantics — this is additive, not a replacement. An 'open' reply carries `evidence` (the agent tool-registry's {source,id} refs, §4.2) instead of the closed-vocabulary `licenses` array, because an open reply is not selected from a fixed set of licensed relationship claims the way an 'answer' is.",
  "type": "object",
  "additionalProperties": false,
  "required": ["schema_version", "kind", "text", "synced_through", "licenses"],
  "properties": {
    "schema_version": { "const": "chat_reply.v2" },
    "kind": { "enum": ["answer", "decline", "open"] },
    "text": { "type": "string", "minLength": 1, "maxLength": 1000 },
    "synced_through": { "type": "string", "format": "date-time" },
    "licenses": {
      "description": "Closed-vocabulary evidence (kind=answer/decline). Empty for kind=open — an open reply's evidence is `evidence`, not `licenses`.",
      "type": "array",
      "maxItems": 5,
      "items": {
        "type": "object",
        "additionalProperties": false,
        "required": ["contact_id", "display", "reason"],
        "properties": {
          "contact_id": { "type": "string", "pattern": "^h_[0-9a-f]{8,32}$" },
          "display": { "type": "string", "maxLength": 64 },
          "reason": { "type": "string", "maxLength": 140 }
        }
      }
    },
    "evidence": {
      "description": "Agent tool-registry evidence refs (§4.2) grounding an open reply. Required if and only if kind=open.",
      "type": "array",
      "maxItems": 50,
      "items": {
        "type": "object",
        "additionalProperties": false,
        "required": ["source", "id"],
        "properties": {
          "source": { "type": "string", "minLength": 1, "maxLength": 40 },
          "id": { "type": "string", "minLength": 1, "maxLength": 80 }
        }
      }
    },
    "follow_up_draft": { "$ref": "draft_delivery.v1.json" }
  },
  "allOf": [
    {
      "if": {
        "properties": { "kind": { "const": "open" } },
        "required": ["kind"]
      },
      "then": {
        "required": ["evidence"],
        "properties": { "licenses": { "maxItems": 0 } }
      },
      "else": { "not": { "required": ["evidence"] } }
    }
  ]
}
